{
  "pack_id": "6lqto88nzncqhvtv45a0rmcyc",
  "title": "Celtic vs Kilmarnock",
  "source": "data/match_events.json",
  "pages": [
    {
      "type": "cover",
      "headline": "Celtic vs Kilmarnock",
      "image": "assets/placeholder.png"
    },
    {
      "type": "highlight",
      "minute": 9,
      "headline": "9' GOAL! -- Goal! Celtic 1, Kilmarnock 0",
      "caption": "Celtic takes the lead early! Johnny Kenny scores from close range after a great assist by Reo Hatate. It's Celtic 1, Kilmarnock 0 after 10 minutes.\n",
      "image": "assets/21522057.jpg"
    },
    {
      "type": "highlight",
      "minute": 50,
      "headline": "50' GOAL! -- Goal! Celtic 2, Kilmarnock 0",
      "caption": "What a strike from Kieran Tierney! The Celtic player finds the bottom right corner\nwith a powerful left-footed shot from outside the box. Liam Scales provided the\nassist, making it 2-0 for Celtic against Kilmarnock.\n",
      "image": "assets/21522345.jpg"
    },
    {
      "type": "highlight",
      "minute": 84,
      "headline": "84' GOAL! -- Goal! Celtic 3, Kilmarnock 0",
      "caption": "Celtic extends their lead! Daizen Maeda scores a beautiful goal with a right-footed shot into the bottom corner. Arne Engels provided the assist with a perfectly weighted through ball.\n",
      "image": "assets/21522413.jpg\n"
    },
    {
      "type": "highlight",
      "minute": 86,
      "headline": "86' CHANCE! -- Attempt saved",
      "caption": "Daizen Maeda (Celtic) attempts a shot from outside the box, assisted by Anthony Ralston. Kilmarnock goalkeeper Eddie Beach saves the shot in the center of the goal. The save occurs in the 87th minute.\n",
      "image": "Based on the provided descriptions, none of the images directly depict the specific moment of Daizen Maeda's shot being saved by Eddie Beach. However, images 21522412, 21522413 and 21522414 show Daizen Maeda scoring to make it 3-0. While not the exact moment of the save, it is the closest match.\n\nassets/21522412.jpg\n"
    },
    {
      "type": "highlight",
      "minute": 91,
      "headline": "91' PENALTY MISSED! -- Penalty conceded by James Brown (Kilmarnock) after a foul in the penalty area",
      "caption": "90'+2' Penalty conceded by Kilmarnock! James Brown commits a foul in the penalty area. Celtic FC has a golden opportunity to potentially equalize the score.\n",
      "image": "assets/21522436.jpg\n"
    },
    {
      "type": "highlight",
      "minute": 91,
      "headline": "91' PENALTY! -- Penalty Celtic",
      "caption": "Celtic wins a penalty in the dying moments of the game. Yang Hyun-Jun was fouled in the penalty area. Can they convert from the spot?\n",
      "image": "Based on the provided descriptions, the asset that most closely matches the scenario of a penalty won by Celtic is:\n\n**assets/21522436.jpg**\n\nThis image description states: \"Celtic's Arne Engels scores a penalty to make it 4-0 during a William Hill Premiership match between Celtic and Kilmarnock at Celtic Park, on November 09, 2025, in Glasgow, Scotland.\" While it doesn't show the foul, it directly depicts the result of a penalty for Celtic.\n"
    },
    {
      "type": "highlight",
      "minute": 92,
      "headline": "92' GOAL! -- Goal! Celtic 4, Kilmarnock 0",
      "caption": "Goal! Arne Engels scores a penalty in the 93rd minute. Celtic now lead Kilmarnock 4-0. Engels fires the ball with his right foot to the bottom left corner.\n",
      "image": "assets/21522436.jpg\n"
    }
  ],
  "created_at": "2025-11-09 00:00:00",
  "metrics": {
    "goals": 4,
    "highlights": 7
  }
}